,id,job_title,description,location,employer,date_posted,n_applicants,industries,industries_1,industries_2,employment_type,job_function,job_function_1,seniority_level
0,2170827259,Product Analyst: Back Office,"We're looking for a skilled Product Analyst to help develop and optimise a key ticketing system. Are you the missing ingredient in our dynamic Back Office team?Our Story (the Bite-size Version)Since our first delivery way back in 2000, we've transformed from a small attic business to a food-delivery powerhouse, serving up millions of tasty treats every week across 11 countries.But the secret of our growth isn't food. It's tech. Across our Berlin tech hub, everyone from software engineers to product analysts and IT support specialists help give our customers and colleagues everything they need.Your New TeamWithin Back Office we provide high-quality products and services to empower our colleagues to work better and more efficiently, and to enable the growth of our platform and company. Our main product is used by almost 3000 employees in 10 countries and supports all Takeaway.com departments.Together with your teammates of the Back Office Platform team in Enschede, you are responsible for the best possible user journey in our internally used Content Management System. You will be part of a multidisciplinary Product team consisting of frontend and backend developers, Quality Assurance, UX/UI researchers/designers, a Product Owner and Scrum Master.All About The RoleYou're a data-driven thinker, identifying opportunities and proposing action to your team and external stakeholders. That means taking an innovative approach to improving our business – combining your expertise on data-gathering with your strategic skills.As a good communicator, you're able to quickly understand any issues and questions stakeholders have and give them straightforward advice and useful solutions. You'll also assist your team members in getting the most out of data and analytics tools.Being our analytics ace also means you'll have the opportunity to:Design measurable metrics and KPIs to help support our stakeholdersDevelop reports using BI tools and languages like Tableau, Amazon Redshift SQL and Python - helping stakeholders track their achievementsAct as an expert and first point of contact for behavioural analysisCreate a tracking plan to understand how the product is used by CS agentsCan you deliver...Ready to take our ticketing system to the next level? Then we're hoping you fit the bill for these points:3+ years' experience as a Web Analyst, Product Analyst or similarAdvanced knowledge of SQL and BI – especially Tableau and Google AnalyticsWorking knowledge of another data analytics tool, e.g. R, PythonConfident doing in-depth analyses, including examining our funnel of key workflowsGood communicator who enjoys being part of a team environmentFluent English language skills (written & spoken).Here Is Our OfferOpportunity to make a major impact as part of a globally-renowned brandPossibilities to strengthen your skills and grow in the roleBeing part of a new, young, professional and international teamA vibrant office location in Enschede, 26 days of vacation Internal as well as external schoolings and conferencesHackathons and prototyping of new solutions.Ready to join our team in Enschede? Click 'Apply Now' and send us your CV.Department: Data & AnalyticsShow moreShow lessSeniority levelAssociateEmployment typeFull-timeJob functionBusiness DevelopmentSalesIndustriesInternetStaffing and RecruitingHuman Resources","Hamburg, Hamburg, Germany",Just Eat Takeaway.com,2021-03-12,120 applicants,Internet,Staffing and Recruiting,Human Resources,Full-time,Business Development,Sales,Associate
1,2457317905,Data Analyst (m/w/d) (Mathematiker/in),"Seit über zehn Jahren verhilft die Synatix GmbH dem Mittelstand auf die Sprünge, verschafft Unternehmen neue Perspektiven, öffnet Märkte. Möglich macht das ein interdisziplinäres Team aus 90 Mitarbeitern, für das wir regelmäßig Verstärkung suchen.Interessiert? Dann bringe bitte Folgendes mit: Mut, Feuer, Köpfchen und die richtigen Qualifikationen. Du hast außerdem keine Scheu vor großen Aufgaben, packst Herausforderungen nicht mit Samthandschuhen an. Und du solltest kein Problem damit haben, dass wir uns duzen: Wir arbeiten ausnahmslos in Teams, die sich aufeinander verlassen können. Da bleibt kein Platz für Formalitäten.Begeistere uns, fordere uns, bringe Leidenschaft für den Mittelstand mit und uns auf neue Ideen. Dann bist du bei uns genau richtig.Als Data Analyst (m/w/d) stellst du sicher, dass wir dank bester Datenqualität jederzeit genau wissen, wie unsere Projekte performen. Du nutzt flexible Methoden zur Analyse des Nutzerverhaltens, durchleuchtest alle entscheidenden Details und entwirfst zielführende A/B-Tests. Aus deinen differenzierten Erhebungen leitest du strategische Empfehlungen für die Weiterentwicklung unterschiedlicher Projekte ab. Außerdem fasst du deine Erkenntnisse in aussagekräftigen Reports und Prognosen zusammen. Bei Bedarf vervollständigst du deine Befunde im Austausch mit den anderen Abteilungen und schaffst so eine verlässliche Datengrundlage für wichtige Projektentscheidungen.Dazu bringst du idealerweise bereits zwei Jahre Berufserfahrung in der Datenanalyse mit, deine Fähigkeiten konntest du in verschiedenen Projekten unter Beweis stellen. Ein erfolgreich abgeschlossenes Studium der Wirtschaftswissenschaften, Informatik, Mathematik oder Statistik ist ein Vorteil, aber nicht zwingend erforderlich. In jedem Fall überzeugst du jedoch durch ausgezeichnete SQL-Kenntnisse und einen routinierten Umgang mit gängigen Datenbanken. Zusätzliche Erfahrungen mit Python oder Google BigQuery sind gern gesehen. Du besitzt ein ausgeprägtes Zahlenverständnis, näherst dich Problemen mit einer analytischen Denkweise und bist ständig auf der Suche nach neuen Antworten. Abgerundet wird dein Profil von hoher Lernbereitschaft und einer strukturierten, zuverlässigen Arbeitsweise, die genügend Raum für neue Ideen bietet.Einarbeiten: Werde Teil unseres Netzwerks. Vom ersten Tag an.Flexibles Arbeiten: Individuelle Gleitzeiten mit Ausschlaffaktor.Mobile Working: Ob als Teil des Teams vor Ort oder im Homeoffice.Ausstattung: Moderne Arbeitsmittel, nach deinen individuellen Vorlieben.Weiterentwicklung: Wir fördern dich. Ob Konferenzen oder Weiterbildungen.Schick’ uns deine aussagekräftige Bewerbung an:click applyShow moreShow lessSeniority levelEntry levelEmployment typeFull-timeJob functionInformation TechnologyIndustriesMarketing and AdvertisingInformation Technology and ServicesInternet","Hameln, Lower Saxony, Germany",Synatix GmbH,2021-03-13,0,Marketing and Advertising,Information Technology and Services,Internet,Full-time,Information Technology,,Entry level
2,2457635593,Business Analyst (m/w/d),"Beschreibung Du entwickelst und verantwortest Reports zum Tagesgeschäft und identifizierst datengestützt Optimierungspotentiale  Du findest effiziente Lösungen zur Automatisierung unserer Prozesse und ermöglichst reibungslose operative Abläufe  Du beschaffst relevante Datensätze mittels SQL und Python aus verschiedenen Datenbanken und visualisierst komplexe Zusammenhänge in Tableau/Power BI und Dashboards  Du analysierst große Datensätze anhand von KPIs und arbeitest an der Konzeption von neuartigen Analyseansätzen Anforderungen Du hast einen sehr guten Bachelor- oder Masterabschluss - bevorzugt in Wirtschaftsinformatik oder einem anderen quantitativen Studienfach  Du konntest bereits mindestens ein Jahr praktische Erfahrung in einem Startup, einer Unternehmensberatung oder einem dynamischen, schnell wachsenden Unternehmen sammeln  Du hast relevante Erfahrung mit der Analyse und Aufbereitung komplexer Daten  Du zeigst starke logisch-analytische Fähigkeiten sowie sehr gute Kenntnisse in Excel sowie gute Kenntnisse in SQL und idealerweise Python  Du sprichst sehr gut Deutsch und hast exzellente Englischkenntnisse Leistungen Die Chance, in einem schnell wachsenden, zukunftsorientierten Startup zu starten und dabei von der engen Zusammenarbeit mit dem Management-Team zu profitieren  Mitwirken in einem hochdynamischen Umfeld, selbstbestimmtes und eigenverantwortliches Arbeiten und spannende Karrieremöglichkeiten  direkter Impact auf unseren Unternehmenserfolg  Obst / Getränke Flatrate, Gympass Mitgliedschaft und legendäre Teamevents  Eine offene Unternehmenskultur, in der Wert auf Transparenz gelegt wirdShow moreShow lessSeniority levelAssociateEmployment typeFull-timeJob functionBusiness DevelopmentSalesIndustriesInformation Technology and ServicesInternetStaffing and Recruiting","Berlin, Berlin, Germany",Enpal GmbH,2021-03-13,0,Information Technology and Services,Internet,Staffing and Recruiting,Full-time,Business Development,Sales,Associate
3,2457260358,(Junior) Marketing Technologist (m/w/d) (Data-Warehouse-Analyst/in),"""Wir haben uns das Ziel gesetzt, mehr Bergzeit in das Leben unserer Kunden zu bringen. Das wollen wir mit Shop, Magazin und Erlebnis erreichen. Und mit Dir! Willst Du Teil unseres 300-köpfigen Teams werden?“So Sieht Dein Aufgabengebiet AusBetreuung und Schnittstelle der Produkte Onsite-Engagement Tool, Recommendations und Cookie-BannerKoordination von Measurement-Fragen rund um Google Analytics und Tracking, enge Abstimmung mit dem Analytics Engineering TeamDurchführung von Analysen im Data Services Bereich und Austausch mit Stakeholdern, d.h. Onsite, Campaign und Customer Analytics mit Dashboards, perspektivisch SQL und PythonTechnische Unterstützung in der Umsetzung und Qualitätssicherung von A/B TestsKoordination des Analytics Power User Programms, einem Inhouse-Programm zur Schulung von DatenkompetenzPerspektivische Unterstützung bei externen Datenanbindungen an eigenen Data-Plattformen mit Python und SQLDas Bringst Du MitAusbildung oder Studium im verwandtem und analytischen UmfeldBerufserfahrung in einer datengetriebenen Rolle mit Technologiebezug, Performance Marketing, Webanalyse, Conversion Optimierung o.a.Hohe Affinität zu Analytics und E-Commerce, sowie Web-Technologien und Big Data-MedthodenHohe Datenkompetenz mit in Statistik und analytischer Tabellenkalkulation, idealerweise Grundkenntnisse SQLDas Erwartet Dich Bei BergzeitMehr Bergzeit: Wir bieten Dir flexible Arbeitszeiten.So kannst Du Deinen Bergsport mit Deiner Arbeit verbinden.Mehr Sport: Auch bei uns im Büro kannst Du zumBeispiel mit Yoga, Rad- oder Klettertreffs mehr Sportin Dein Leben bringen.Mehr Vorteile: Alle Bergzeit Mitarbeiter profitieren von Vergünstigungen im Bergzeit Shop.Mehr Raum für Kreativität: In unseren modernen Büros findest Du Raum für kreatives Arbeiten.Mehr Genuss: Wir bieten Dir jeden Tag frisch gekochteMahlzeiten aus regionalen Zutaten in unserer Kantine.Mehr Perspektiven: Nutze unsere Angebote zu internen wie externen Weiterbildungen sowie zur betrieblichen Altersvorsorge.Haben wir Dein Interesse geweckt? Dann freuen wir uns auf Deine aussagekräftige Online-Bewerbung mit Deiner Gehaltsvorstellung und Angabe des frühestmöglichen Eintrittstermins unterWir freuen uns auf Dich!Christina vom Bergzeit-TeamShow moreShow lessSeniority levelEntry levelEmployment typeFull-timeJob functionMarketingSalesIndustriesMarketing and AdvertisingInformation Technology and ServicesInternet","Otterfing, Bavaria, Germany",Bergzeit,2021-03-13,0,Marketing and Advertising,Information Technology and Services,Internet,Full-time,Marketing,Sales,Entry level
4,2444860228,Consultant Analytics (m/w/d),"Mehr als 10.800 Filialen und 150 Logistikzentren in 30 Ländern – das ist Lidl. Um unsere anspruchsvollen Ziele weiterhin effizient erreichen zu können, suchen wir Dich als Verstärkung für unseren Analytics-Bereich. Hier begleiten wir Lidl auf dem Weg zu einem datengetriebenen Unternehmen und pilotieren im „Fail-Fast Ansatz“ innovative Business-Anwendungen im Schulterschluss mit den Fachabteilungen (Vertrieb, Einkauf etc.). Dazu beraten wir diese bei Fragestellungen und gestalten weltweite Geschäftsprozesse mit. Zusätzlich unterstützen wir die Länder, dezentral Analytics-Kompetenzen aufzubauen und durch eine enge Zusammenarbeit die internationalen Synergien zu schöpfen. Bewirke Großes und erlebe, dass sich Dein Einstieg lohnt – am internationalen Hauptsitz von Lidl in Neckarsulm.Deine AufgabenAls Consultant Analytics (m/w/d) unterstützt Du unsere Fachbereiche und Landesgesellschaften bei der Entscheidungsfindung für aktuelle Themen im weitreichenden Unternehmenskontext.Du begleitest den gesamten Prozess einer Analyse, von der Definition der Fragestellung und Zielsetzung bis hin zu einer Empfehlung. Ggf. erstellst Du in Zusammenarbeit mit Data Scientists datengetriebene Prototypen.Beispielsweise könnte in einer Analyse festgestellt werden, ob die Umstellung einer Werbemaßnahme, des Sortiments, etc. einen positiven Effekt auf die Kundenansprache und Wirtschaftlichkeit hat.Der Prozess wird von Dir verantwortet und entweder führst Du selbständig Analysen durch oder arbeitest eng mit dem Analytics Team (inkl. Data Scientists) zusammen. Du fungierst im Bedarfsfall, auch im internationalen Umfeld der Landesorganisation, als Ansprechpartner für unsere lokalen Analytics Consultants.Dein ProfilAbgeschlossenes Studium im Bereich Betriebswirtschaftslehre, Volkswirtschaftslehre, Mathematik/Statistik, (Wirtschafts-) Informatik oder einem vergleichbaren StudiengangBerufserfahrung im Inhouse Consulting oder einer UnternehmensberatungGute Kenntnisse in SQL sowie in mindestens einem der Programme R oder Python bzw. alternativen Analytics-Tools wie Alteryx, KNIME oder Rapidminer Idealerweise Erfahrung mit Regressions- oder Zeitreihenanalysen bzw. Wirksamkeitstests (A-/B-, Hypothesentests)Strukturierte und zielorientierte Arbeitsweise, Hands-on-MentalitätLust auf gelegentliche internationale Projekteinsätze in unseren Lidl LändernSehr gute Deutsch- und gute EnglischkenntnisseDeine VorteileWir legen Wert darauf, dass sich dein Einstieg bei uns lohnt! Daher profitierst du bei uns nicht nur von einer überdurchschnittlichen Vergütung und allen Sozialleistungen eines Großunternehmens. Wir erkennen die vielfältigen Bedürfnisse unserer Kolleginnen und Kollegen an und entwickeln Lösungen zur Vereinbarkeit von Berufs- und Privatleben. Ein persönlicher Pate macht dich vom ersten Tag an mit deinem Job vertraut und ist dein Ansprechpartner für alle Fragen, rund um das Unternehmen. So findest du dich bei uns schnell zurecht – und so kannst du von Beginn an das kollegiale Miteinander und die individuellen Weiterbildungsmöglichkeiten für dich entdecken.Show moreShow lessSeniority levelAssociateEmployment typeFull-timeJob functionBusiness DevelopmentSalesIndustriesRetailFood & BeveragesSupermarkets","Neckarsulm, Baden-Württemberg, Germany",Lidl in Germany,2021-03-12,0,Retail,Food & Beverages,Supermarkets,Full-time,Business Development,Sales,Associate
